{
  "schema_version": "nu-research-catalog-1.0",
  "university_id": "nazarbayev-university-kaz-astana",
  "official_name": "Nazarbayev University",
  "runtime_active": false,
  "research_status": "in_progress",
  "example_scope": "Partial excerpt showing that 2027/28 post-offer NUET support (120/50/50) and 2026/27 mid-year admission (130/60/60) remain separate. This is not the complete 93-card catalog.",
  "snapshot": {
    "assignment_date": "2026-10-23",
    "assigned_inventory_count": 93
  },
  "inputs": [
    {
      "packet_id": "a",
      "path": "backend/data/drafts/nazarbayev-university-kaz-astana/packet-a/research.json",
      "sha256": "ffc223262933e5fcd90ae26d0ca57eb4d9ed93f5bfd557acb9caff57f9f2e874",
      "handoff_status": "ready_for_review",
      "handoff_path": "backend/data/drafts/nazarbayev-university-kaz-astana/packet-a/handoff.md",
      "handoff_sha256": "f49ceabfbf23a7372a73b8865203b85095028ef7f75c6cc211937344b5842891"
    }
  ],
  "inventory_entries": [],
  "study_options": [],
  "application_routes": [
    {
      "id": "nu-a-route-financial-support",
      "owner_packet": "a",
      "title": "Post-offer financial-support consideration",
      "classification": null,
      "target": null,
      "destination": null,
      "option_ids": [
        "nu-a-study-bachelor-of-science-in-geology",
        "nu-a-study-bachelor-of-science-in-mathematics",
        "nu-a-study-bachelor-of-science-in-physics",
        "nu-a-study-bachelor-of-science-in-chemistry",
        "nu-a-study-bachelor-of-arts-in-sociology",
        "nu-a-study-bachelor-of-arts-in-political-science-and-international-relations",
        "nu-a-study-bachelor-of-science-in-computer-science",
        "nu-a-study-6-year-undergraduate-medical-program",
        "nu-a-study-bachelor-of-science-in-biological-sciences",
        "nu-a-study-bachelor-of-business-administration",
        "nu-a-study-bachelor-of-arts-in-economics",
        "nu-a-study-bachelor-of-science-in-robotics-engineering",
        "nu-a-study-bachelor-of-science-in-mining-and-minerals-engineering",
        "nu-a-study-bachelor-of-science-in-petroleum-engineering",
        "nu-a-study-nu-foundation-year-program",
        "nu-a-study-bachelor-of-engineering-in-chemical-and-materials-engineering",
        "nu-a-study-bachelor-of-engineering-in-electrical-and-computer-engineering",
        "nu-a-study-bachelor-of-engineering-in-civil-and-environmental-engineering",
        "nu-a-study-bachelor-of-engineering-in-mechanical-and-aerospace-engineering"
      ],
      "fact_ids": [
        "nu-a-fact-financial-sequence",
        "nu-a-fact-nuet-support",
        "nu-a-fact-financial-support-eligibility-2027-28",
        "nu-a-fact-fees-table"
      ],
      "source_ids": [
        "nu-a-src-ug-aid",
        "nu-a-src-ug-regular"
      ],
      "scope": {
        "option_ids": null,
        "route_ids": [
          "nu-a-route-financial-support"
        ],
        "study_levels": null,
        "applicant_categories": null,
        "cycle": null,
        "fee_status": null,
        "additional_dimensions": {
          "unparsed_scope": "NUFYP/undergraduate applicants in listed categories; eligibility is distinct from admission and aid decision."
        },
        "original_scope": "NUFYP/undergraduate applicants in listed categories; eligibility is distinct from admission and aid decision."
      },
      "attributes": {
        "scope": "NUFYP/undergraduate applicants in listed categories; eligibility is distinct from admission and aid decision.",
        "applicant_categories": [
          "NUET",
          "SAT/ACT",
          "international/republican subject olympiad",
          "IB Diploma",
          "A-level/NIS Grade 12",
          "NUFYP students"
        ],
        "process_fact_id": "nu-a-fact-financial-sequence",
        "nuet_requirement_fact_id": "nu-a-fact-nuet-support",
        "exceptions": [
          "Regular offer acceptance/guarantee payment excludes financial-support consideration.",
          "Mid-year spring semester self-funded enrollees do not compete for NU or other grants.",
          "NUET aid thresholds differ by intake and category.",
          "For 2027/28, NUET total 120 plus 50 in each section is expressly a financial-support/state-grant eligibility minimum after an offer. Do not merge it with mid-year admission 130/60/60 or with unqualified standard UG academic alternatives.",
          "Published tuition-coverage options are 75% social vulnerability (KZ citizens), 25% Olympiad (UG), 25% sibling, and 50% eligible government employee. Exact cycle, document proof, term/renewal and stacking are not stated. The 5% one-payment discount is separate.",
          "2027/28 announcement says accepting the regular offer excludes the separate support application. The 2026 policy has a narrower waiting-list/capacity exception where a fee-paying waitlisted offer can remain in grant competition; preserve this dated scope rather than broadening it.",
          "Current support page lists category minimums and fees but support award coverage/renewal/stacking is not published for all categories. Separate financial-aid percentages on the general fees page have their own eligibility scopes."
        ],
        "coverage_fact_id": "nu-a-fact-financial-support-eligibility-2027-28",
        "fee_reference_fact_id": "nu-a-fact-fees-table",
        "eligibility_fact_id": "nu-a-fact-financial-support-eligibility-2027-28",
        "study_levels": [
          "preparation",
          "undergraduate"
        ]
      },
      "provenance": {
        "packet_id": "a",
        "evidence_file": "packet-a/research.json",
        "original_id": "nu-a-route-financial-support",
        "original_scope": "NUFYP/undergraduate applicants in listed categories; eligibility is distinct from admission and aid decision.",
        "original_source_ids": [
          "nu-a-src-ug-aid",
          "nu-a-src-ug-regular"
        ]
      }
    },
    {
      "id": "nu-a-route-midyear-2026-27",
      "owner_packet": "a",
      "title": "Undergraduate mid-year fee-paying intake",
      "classification": null,
      "target": null,
      "destination": null,
      "option_ids": [],
      "fact_ids": [
        "nu-a-fact-midyear-window",
        "nu-a-fact-midyear-nuet"
      ],
      "source_ids": [
        "nu-a-src-ug-regular",
        "nu-a-src-midyear",
        "nu-a-src-midyear-indexed-page"
      ],
      "scope": {
        "option_ids": null,
        "route_ids": [
          "nu-a-route-midyear-2026-27"
        ],
        "study_levels": null,
        "applicant_categories": null,
        "cycle": null,
        "fee_status": null,
        "additional_dimensions": {
          "unparsed_scope": "2026/27 spring semester; applicants already graduated secondary school or currently enrolled at other university; fee-paying only."
        },
        "original_scope": "2026/27 spring semester; applicants already graduated secondary school or currently enrolled at other university; fee-paying only."
      },
      "attributes": {
        "scope": "2026/27 spring semester; applicants already graduated secondary school or currently enrolled at other university; fee-paying only.",
        "cycle_fact_id": "nu-a-fact-midyear-window",
        "exceptions": [
          "The official indexed page lists SAT 2025-12-06 and ACT 2025-02-13 as latest accepted dates. Both dates fall within the stated two-year validity at the 2026-11-28 deadline, so staleness is not established. The direct portal path returns 404; the indexed snapshot is retained separately.",
          "NUET category minimum 130 total and at least 60 in each section; current calendar-year tests only.",
          "Transfer route has separate eligibility and limited application round.",
          "The mid-year 2026/27 UG NUET threshold (130/60/60) is separate from NUFYP regular entry 120/50/50, the policy-defined UG NUET category, and the 2027/28 aid/state-grant threshold."
        ],
        "nuet_requirement_fact_id": "nu-a-fact-midyear-nuet",
        "study_levels": [
          "undergraduate"
        ]
      },
      "provenance": {
        "packet_id": "a",
        "evidence_file": "packet-a/research.json",
        "original_id": "nu-a-route-midyear-2026-27",
        "original_scope": "2026/27 spring semester; applicants already graduated secondary school or currently enrolled at other university; fee-paying only.",
        "original_source_ids": [
          "nu-a-src-ug-regular",
          "nu-a-src-midyear",
          "nu-a-src-midyear-indexed-page"
        ]
      }
    }
  ],
  "facts": [
    {
      "id": "nu-a-fact-midyear-window",
      "owner_packet": "a",
      "topic": "application_window",
      "topic_field": "kind",
      "value": {
        "cycle": "2026/27_midyear",
        "application_period": "2026-08-18 to 2026-11-28 14:00 Astana time",
        "test_result_deadline": "2026-11-28 23:59 Astana time",
        "delivery": "spring-semester entry, fee-paying",
        "applicant_categories": [
          "secondary-school graduates",
          "students currently enrolled at another university"
        ],
        "eligible_entry_categories": [
          "full tuition fee-paying",
          "NUET",
          "SAT/ACT",
          "IB Diploma",
          "A-level/NIS Grade 12",
          "Olympiad winners",
          "transfer"
        ],
        "eligibility_cycle": "2026/27 spring semester; fee-paying only"
      },
      "scope": {
        "option_ids": [],
        "route_ids": [
          "nu-a-route-midyear-2026-27"
        ],
        "study_levels": [
          "undergraduate"
        ],
        "applicant_categories": null,
        "cycle": null,
        "fee_status": null,
        "additional_dimensions": {
          "source_scope_original": null
        },
        "original_scope": {
          "source_scope_original": null,
          "study_option_ids": [],
          "study_levels": [
            "undergraduate"